----------------------------------------------------------------------------------------------------
------------------------------------ MegaLinter, by OX Security ------------------------------------
----------------------------------------------------------------------------------------------------
 - Image Creation Date: 2024-08-19T21:44:53Z
 - Image Revision: 378cc7a36ad17c7f458333ebf6803a5069fff007
 - Image Version: v8.0.0
----------------------------------------------------------------------------------------------------
The MegaLinter documentation can be found at:
 - https://megalinter.io/8.0.0
----------------------------------------------------------------------------------------------------
::group::MegaLinter initialization (expand for details)
MegaLinter will analyze workspace [/github/workspace]
GITHUB_REPOSITORY: liblaf/assets
GITHUB_REF: refs/pull/38/merge
GITHUB_RUN_ID: 11305395938


[Activation] ANSIBLE_ANSIBLE_LINT has been set inactive, as none of these files has been found: ['.ansible-lint']
[Activation] EDITORCONFIG_EDITORCONFIG_CHECKER has been set inactive, as none of these files has been found: ['.editorconfig']
[Activation] JAVASCRIPT_ES has been set inactive, as none of these files has been found: ['.eslintrc.json', '.eslintrc.yml', '.eslintrc.yaml', '.eslintrc.js', '.eslintrc.cjs', 'package.json:eslintConfig']
[Activation] JSX_ESLINT has been set inactive, as none of these files has been found: ['.eslintrc.json', '.eslintrc.yml', '.eslintrc.yaml', '.eslintrc.js', '.eslintrc.cjs', 'package.json:eslintConfig']
[Activation] KUBERNETES_KUBECONFORM has been set inactive, as subdirectory has not been found: kubernetes (set value "any" to always activate)
[Activation] KUBERNETES_HELM has been set inactive, as none of these files has been found: ['Chart.yml', 'Chart.yaml']
[Activation] KUBERNETES_KUBESCAPE has been set inactive, as none of these files has been found: ['Chart.yml', 'Chart.yaml']
[Activation] REPOSITORY_LS_LINT has been set inactive, as none of these files has been found: ['.ls-lint.yml']
[SemgrepLinter] Deactivated because no ruleset has been defined
[Activation] SALESFORCE_SFDX_SCANNER_APEX has been set inactive, as subdirectory has not been found: force-app (set value "any" to always activate)
[Activation] SALESFORCE_SFDX_SCANNER_AURA has been set inactive, as subdirectory has not been found: force-app (set value "any" to always activate)
[Activation] SALESFORCE_SFDX_SCANNER_LWC has been set inactive, as subdirectory has not been found: force-app (set value "any" to always activate)
[Activation] SALESFORCE_LIGHTNING_FLOW_SCANNER has been set inactive, as subdirectory has not been found: force-app (set value "any" to always activate)
[Activation] SPELL_PROSELINT has been set inactive, as none of these files has been found: ['.proselintrc', 'proselint/config.json']
[Activation] SPELL_VALE has been set inactive, as none of these files has been found: ['.vale.ini']
[Activation] SQL_SQLFLUFF has been set inactive, as none of these files has been found: ['.sqlfluff']
[Activation] SWIFT_SWIFTLINT has been set inactive, as none of these files has been found: ['.swiftlint.yml']
[Activation] TSX_ESLINT has been set inactive, as none of these files has been found: ['.eslintrc.json', '.eslintrc.yml', '.eslintrc.yaml', '.eslintrc.js', '.eslintrc.cjs', 'package.json:eslintConfig']
[Activation] TYPESCRIPT_ES has been set inactive, as none of these files has been found: ['.eslintrc.json', '.eslintrc.yml', '.eslintrc.yaml', '.eslintrc.js', '.eslintrc.cjs', 'package.json:eslintConfig']
CLOJURE_CLJSTYLE has been disabled in MegaLinter for the following reason: Bug on cljstyle on alpine linux: https://github.com/greglook/cljstyle/issues/104
JSON_ESLINT_PLUGIN_JSONC has been disabled in MegaLinter for the following reason: Bug in eslint-plugin-jsonc : https://github.com/ota-meshi/eslint-plugin-jsonc/issues/328
MAKEFILE_CHECKMAKE has been disabled in MegaLinter for the following reason: Security issues: https://github.com/mrtazz/checkmake/issues/99
MARKDOWN_REMARK_LINT has been disabled in MegaLinter for the following reason: Bug in remark-lint: https://github.com/remarkjs/remark-lint/issues/322
SQL_TSQLLINT has been disabled in MegaLinter for the following reason: Security issues not handled: # https://github.com/tsqllint/tsqllint/issues/333
Skipped linters: ANSIBLE_ANSIBLE_LINT, BASH_EXEC, CLOJURE_CLJSTYLE, EDITORCONFIG_EDITORCONFIG_CHECKER, JAVASCRIPT_ES, JAVASCRIPT_PRETTIER, JSON_ESLINT_PLUGIN_JSONC, JSX_ESLINT, KUBERNETES_HELM, KUBERNETES_KUBECONFORM, KUBERNETES_KUBESCAPE, MAKEFILE_CHECKMAKE, MARKDOWN_REMARK_LINT, PYTHON_BANDIT, PYTHON_BLACK, PYTHON_FLAKE8, PYTHON_ISORT, PYTHON_MYPY, PYTHON_PYLINT, REPOSITORY_LS_LINT, REPOSITORY_SEMGREP, SALESFORCE_LIGHTNING_FLOW_SCANNER, SALESFORCE_SFDX_SCANNER_APEX, SALESFORCE_SFDX_SCANNER_AURA, SALESFORCE_SFDX_SCANNER_LWC, SPELL_PROSELINT, SPELL_VALE, SQL_SQLFLUFF, SQL_TSQLLINT, SWIFT_SWIFTLINT, TSX_ESLINT, TYPESCRIPT_ES, TYPESCRIPT_PRETTIER
To receive reports as email, please set variable EMAIL_REPORTER_EMAIL
::endgroup::
::group::MegaLinter now collects the files to analyse (expand for details)
Listing all files in directory [/github/workspace], then filter with:
- File extensions: , .R, .RMD, .Rmd, .bash, .bicep, .c, .c++, .cc, .cdxml, .clj, .cljc, .cljs, .coffee, .cpp, .cs, .csproj, .css, .cu, .cuh, .cxx, .dart, .dash, .edn, .env, .feature, .go, .gradle, .graphql, .groovy, .gvy, .h, .h++, .hcl, .hh, .hpp, .htm, .html, .hxx, .java, .js, .json, .json5, .jsonc, .ksh, .kt, .kts, .lua, .markdown, .md, .mdx, .nf, .p6, .php, .pl, .pl6, .pm, .pm6, .pp, .proto, .ps1, .ps1xml, .psd1, .psm1, .psrc, .pssc, .py, .r, .raku, .rakumod, .rakutest, .rb, .rs, .rst, .saas, .scala, .scss, .sh, .smk, .t, .tex, .tf, .ts, .txt, .vb, .xml, .xsd, .yaml, .yml
- File names (regex): Containerfile, Dockerfile, Jenkinsfile, Snakefile, package\.json
- Excluding .gitignored files [0]: 
Kept [31] files on [35] found files

+----MATCHING LINTERS-------------------+------------------------------------------------------------------------+----------------+------------+
| Descriptor | Linter                   | Criteria                                                               | Matching files | Format/Fix |
+------------+--------------------------+------------------------------------------------------------------------+----------------+------------+
| ACTION     | actionlint               | .yml|.yaml                                                             | 2              | no         |
| COPYPASTE  | jscpd                    |                                                                        | project        | no         |
| CSS        | stylelint                | .css|.scss|.saas                                                       | 2              | yes        |
| JAVASCRIPT | standard                 | .js                                                                    | 1              | yes        |
| JSON       | jsonlint                 | .json                                                                  | 8              | no         |
| JSON       | v8r                      | .json                                                                  | 8              | no         |
| JSON       | prettier                 | .json                                                                  | 8              | yes        |
| JSON       | npm-package-json-lint    | .json|package\.json                                                    | project        | no         |
| MARKDOWN   | markdownlint             | .md                                                                    | 1              | yes        |
| MARKDOWN   | markdown-link-check      | .md                                                                    | 1              | no         |
| MARKDOWN   | markdown-table-formatter | .md                                                                    | 1              | yes        |
| REPOSITORY | checkov                  |                                                                        | project        | no         |
| REPOSITORY | devskim                  |                                                                        | project        | no         |
| REPOSITORY | dustilock                |                                                                        | project        | no         |
| REPOSITORY | git_diff                 |                                                                        | project        | no         |
| REPOSITORY | gitleaks                 |                                                                        | project        | no         |
| REPOSITORY | grype                    |                                                                        | project        | no         |
| REPOSITORY | kics                     |                                                                        | project        | no         |
| REPOSITORY | secretlint               |                                                                        | project        | no         |
| REPOSITORY | syft                     |                                                                        | project        | no         |
| REPOSITORY | trivy                    |                                                                        | project        | no         |
| REPOSITORY | trivy-sbom               |                                                                        | project        | no         |
| REPOSITORY | trufflehog               |                                                                        | project        | no         |
| SPELL      | cspell                   |                                                                        | 31             | no         |
| SPELL      | lychee                   | .md|.mdx|.markdown|.html|.htm|.rst|.txt|.json|.jsonc|.json5|.yaml|.yml | 24             | no         |
| TYPESCRIPT | ts-standard              | .ts                                                                    | 1              | yes        |
| YAML       | prettier                 | .yml|.yaml                                                             | 9              | yes        |
| YAML       | yamllint                 | .yml|.yaml                                                             | 9              | no         |
| YAML       | v8r                      | .yml|.yaml                                                             | 9              | no         |
+------------+--------------------------+------------------------------------------------------------------------+----------------+------------+
::endgroup::
Processing linters on [4] parallel cores… (can be decreased with variable PARALLEL_PROCESS_NUMBER in case of performance issues)
::group::[32m✅ Linted [JSON] files with [prettier] successfully - (0.43s)[0m (expand for details)
- Using [prettier v3.3.3] https://megalinter.io/8.0.0/descriptors/json_prettier
- MegaLinter key: [JSON_PRETTIER]
- Rules config: identified by [prettier]
- Number of files analyzed: [8]
::endgroup::
::group::[32m✅ Linted [CSS] files with [stylelint] successfully - (1.27s)[0m (expand for details)
- Using [stylelint v16.8.2] https://megalinter.io/8.0.0/descriptors/css_stylelint
- MegaLinter key: [CSS_STYLELINT]
- Rules config: [.stylelintrc.json]
- Number of files analyzed: [2]
::endgroup::
::group::[32m✅ Linted [JAVASCRIPT] files with [standard] successfully - (1.86s)[0m (expand for details)
- Using [standard v17.1.0] https://megalinter.io/8.0.0/descriptors/javascript_standard
- MegaLinter key: [JAVASCRIPT_STANDARD]
- Rules config: identified by [standard]
- Number of files analyzed: [1]
::endgroup::
::group::[33m✅ Linted [MARKDOWN] files with [markdownlint]: Found 6 non blocking error(s) - (0.51s)[0m (expand for details)
- Using [markdownlint v0.41.0] https://megalinter.io/8.0.0/descriptors/markdown_markdownlint
- MegaLinter key: [MARKDOWN_MARKDOWNLINT]
- Rules config: [.markdownlint.json]
- Number of files analyzed: [1]
--Error detail:
README.md:5 MD001/heading-increment Heading levels should only increment by one level at a time [Expected: h2; Actual: h3]
README.md:7 MD040/fenced-code-language Fenced code blocks should have a language specified [Context: "```"]
README.md:13 MD040/fenced-code-language Fenced code blocks should have a language specified [Context: "```"]
README.md:21 MD040/fenced-code-language Fenced code blocks should have a language specified [Context: "```"]
README.md:31 MD040/fenced-code-language Fenced code blocks should have a language specified [Context: "```"]
README.md:37 MD040/fenced-code-language Fenced code blocks should have a language specified [Context: "```"]

::endgroup::
::group::[32m✅ Linted [MARKDOWN] files with [markdown-table-formatter] successfully - (0.28s)[0m (expand for details)
- Using [markdown-table-formatter v1.6.1] https://megalinter.io/8.0.0/descriptors/markdown_markdown_table_formatter
- MegaLinter key: [MARKDOWN_MARKDOWN_TABLE_FORMATTER]
- Rules config: identified by [markdown-table-formatter]
- Number of files analyzed: [1]
::endgroup::
::group::[32m✅ Linted [COPYPASTE] files with [jscpd] successfully - (1.36s)[0m (expand for details)
- Using [jscpd v4.0.5] https://megalinter.io/8.0.0/descriptors/copypaste_jscpd
- MegaLinter key: [COPYPASTE_JSCPD]
- Rules config: [.jscpd.json]
::endgroup::
::group::[32m✅ Linted [YAML] files with [prettier] successfully - (3.78s)[0m (expand for details)
- Using [prettier v3.3.3] https://megalinter.io/8.0.0/descriptors/yaml_prettier
- MegaLinter key: [YAML_PRETTIER]
- Rules config: identified by [prettier]
- Number of files analyzed: [9]
::endgroup::
::group::[31m❌ Linted [TYPESCRIPT] files with [ts-standard]: Found 1 error(s) - (4.51s)[0m (expand for details)
- Using [ts-standard v12.0.2] https://megalinter.io/8.0.0/descriptors/typescript_ts_standard
- MegaLinter key: [TYPESCRIPT_STANDARD]
- Rules config: identified by [ts-standard]
- Number of files analyzed: [1]
--Error detail:
ts-standard: Standard for TypeScript! (https://github.com/standard/ts-standard)
  /github/workspace/docusaurus.config.ts:0:0: Parsing error: File '@docusaurus/tsconfig' not found. (null)

::endgroup::
::group::[32m✅ Linted [MARKDOWN] files with [markdown-link-check] successfully - (0.84s)[0m (expand for details)
- Using [markdown-link-check v3.12.2] https://megalinter.io/8.0.0/descriptors/markdown_markdown_link_check
- MegaLinter key: [MARKDOWN_MARKDOWN_LINK_CHECK]
- Rules config: [.markdown-link-check.json]
- Number of files analyzed: [1]
::endgroup::
::group::[32m✅ Linted [REPOSITORY] files with [secretlint] successfully - (0.57s)[0m (expand for details)
- Using [secretlint v8.2.4] https://megalinter.io/8.0.0/descriptors/repository_secretlint
- MegaLinter key: [REPOSITORY_SECRETLINT]
- Rules config: [.secretlintrc.json]
::endgroup::
::group::[31m❌ Linted [REPOSITORY] files with [devskim]: Found 7 error(s) - (1.45s)[0m (expand for details)
- Using [devskim v1.0.33] https://megalinter.io/8.0.0/descriptors/repository_devskim
- MegaLinter key: [REPOSITORY_DEVSKIM]
- Rules config: [/github/workspace/.github/megalinter/.devskim.json]
--Error detail:
[11:55:34 ERR] Failed to parse Data at the root level is invalid. Line 1, position 1. as a XML document: null
[11:55:34 ERR] Failed to parse Data at the root level is invalid. Line 1, position 1. as a XML document: null
[11:55:34 ERR] Failed to parse Data at the root level is invalid. Line 1, position 1. as a XML document: null
{"$schema":"https://schemastore.azurewebsites.net/schemas/json/sarif-2.1.0-rtm.6.json","version":"2.1.0","runs":[{"tool":{"driver":{"name":"devskim","fullName":"Microsoft DevSkim Command Line Interface","version":"1.0.33+9dba5c6c1f","informationUri":"https://github.com/microsoft/DevSkim/","rules":[{"id":"DS126858","name":"WeakbrokenHashAlgorithm","fullDescription":{"text":"Weak/Broken Hash Algorithm: A weak or broken hash algorithm was detected."},"help":{"text":"Consider switching to use SHA-256 or SHA-512 instead.","markdown":"Visit [https://github.com/Microsoft/DevSkim/blob/main/guidance/DS126858.md](https://github.com/Microsoft/DevSkim/blob/main/guidance/DS126858.md) for guidance on this issue."},"shortDescription":{"text":"A weak or broken hash algorithm was detected."},"defaultConfiguration":{"level":"error"},"helpUri":"https://github.com/Microsoft/DevSkim/blob/main/guidance/DS126858.md","properties":{"precision":"high","problem.severity":"error","DevSkimSeverity":"Critical","DevSkimConfidence":"High"}}]}},"versionControlProvenance":[{"repositoryUri":"https://github.com/liblaf/assets","revisionId":"25c82da9d7b9c9e7071651b3ba73565a702b7fcb","branch":"(no branch)"}],"results":[{"ruleId":"DS126858","level":"error","message":{"text":"Weak/Broken Hash Algorithm"},"locations":[{"physicalLocation":{"artifactLocation":{"uri":"pnpm-lock.yaml"},"region":{"startLine":9336,"startColumn":98,"endLine":9336,"endColumn":101,"charOffset":280702,"charLength":3,"snippet":{"text":"mD4","rendered":{"text":"mD4","markdown":"`mD4`"}},"sourceLanguage":"yaml"}}}],"fixes":[],"properties":{"tags":["Cryptography.BannedHashAlgorithm"],"DevSkimSeverity":"Critical","DevSkimConfidence":"High"}},{"ruleId":"DS126858","level":"error","message":{"text":"Weak/Broken Hash Algorithm"},"locations":[{"physicalLocation":{"artifactLocation":{"uri":"pnpm-lock.yaml"},"region":{"startLine":6301,"startColumn":36,"endLine":6301,"endColumn":39,"charOffset":196462,"charLength":3,"snippet":{"text":"mD5","rendered":{"text":"mD5","markdown":"`mD5`"}},"sourceLanguage":"yaml"}}}],"fixes":[],"properties":{"tags":["Cryptography.BannedHashAlgorithm"],"DevSkimSeverity":"Critical","DevSkimConfidence":"High"}},{"ruleId":"DS126858","level":"error","message":{"text":"Weak/Broken Hash Algorithm"},"locations":[{"physicalLocation":{"artifactLocation":{"uri":"pnpm-lock.yaml"},"region":{"startLine":5285,"startColumn":46,"endLine":5285,"endColumn":49,"charOffset":168310,"charLength":3,"snippet":{"text":"md2","rendered":{"text":"md2","markdown":"`md2`"}},"sourceLanguage":"yaml"}}}],"fixes":[{"description":{"text":"A weak or broken hash algorithm was detected."},"artifactChanges":[{"artifactLocation":{"uri":"pnpm-lock.yaml"},"replacements":[{"deletedRegion":{"charOffset":168310,"charLength":3},"insertedContent":{"text":"sha512"}}]}]},{"description":{"text":"A weak or broken hash algorithm was detected."},"artifactChanges":[{"artifactLocation":{"uri":"pnpm-lock.yaml"},"replacements":[{"deletedRegion":{"charOffset":168310,"charLength":3},"insertedContent":{"text":"sha256"}}]}]}],"properties":{"tags":["Cryptography.BannedHashAlgorithm"],"DevSkimSeverity":"Critical","DevSkimConfidence":"High"}},{"ruleId":"DS126858","level":"error","message":{"text":"Weak/Broken Hash Algorithm"},"locations":[{"physicalLocation":{"artifactLocation":{"uri":"pnpm-lock.yaml"},"region":{"startLine":1482,"startColumn":96,"endLine":1482,"endColumn":99,"charOffset":47661,"charLength":3,"snippet":{"text":"Md2","rendered":{"text":"Md2","markdown":"`Md2`"}},"sourceLanguage":"yaml"}}}],"fixes":[],"properties":{"tags":["Cryptography.BannedHashAlgorithm"],"DevSkimSeverity":"Critical","DevSkimConfidence":"High"}},{"ruleId":"DS126858","level":"error","message":{"text":"Weak/Broken Hash Algorithm"},"locations":[{"physicalLocation":{"artifactLocation":{"uri":"pnpm-lock.yaml"},"region":{"startLine":566,"startColumn":37,"endLine":566,"endColumn":40,"charOffset":17631,"charLength":3,"snippet":{"text":"MD5","rendered":{"text":"MD5","markdown":"`MD5`"}},"sourceLanguage":"yaml"}}}],"fixes":[{"description":{"text":"A weak or broken hash algorithm was detected."},"artifactChanges":[{"artifactLocation":{"uri":"pnpm-lock.yaml"},"replacements":[{"deletedRegion":{"charOffset":17631,"charLength":3},"insertedContent":{"text":"SHA256"}}]}]},{"description":{"text":"A weak or broken hash algorithm was detected."},"artifactChanges":[{"artifactLocation":{"uri":"pnpm-lock.yaml"},"replacements":[{"deletedRegion":{"charOffset":17631,"charLength":3},"insertedContent":{"text":"SHA512"}}]}]}],"properties":{"tags":["Cryptography.BannedHashAlgorithm"],"DevSkimSeverity":"Critical","DevSkimConfidence":"High"}},{"ruleId":"DS126858","level":"error","message":{"text":"Weak/Broken Hash Algorithm"},"locations":[{"physicalLocation":{"artifactLocation":{"uri":"pnpm-lock.yaml"},"region":{"startLine":222,"startColumn":85,"endLine":222,"endColumn":88,"charOffset":7207,"charLength":3,"snippet":{"text":"mD4","rendered":{"text":"mD4","markdown":"`mD4`"}},"sourceLanguage":"yaml"}}}],"fixes":[],"properties":{"tags":["Cryptography.BannedHashAlgorithm"],"DevSkimSeverity":"Critical","DevSkimConfidence":"High"}},{"ruleId":"DS126858","level":"error","message":{"text":"Weak/Broken Hash Algorithm"},"locations":[{"physicalLocation":{"artifactLocation":{"uri":"pnpm-lock.yaml"},"region":{"startLine":215,"startColumn":31,"endLine":215,"endColumn":34,"charOffset":6954,"charLength":3,"snippet":{"text":"md2","rendered":{"text":"md2","markdown":"`md2`"}},"sourceLanguage":"yaml"}}}],"fixes":[{"description":{"text":"A weak or broken hash algorithm was detected."},"artifactChanges":[{"artifactLocation":{"uri":"pnpm-lock.yaml"},"replacements":[{"deletedRegion":{"charOffset":6954,"charLength":3},"insertedContent":{"text":"sha512"}}]}]},{"description":{"text":"A weak or broken hash algorithm was detected."},"artifactChanges":[{"artifactLocation":{"uri":"pnpm-lock.yaml"},"replacements":[{"deletedRegion":{"charOffset":6954,"charLength":3},"insertedContent":{"text":"sha256"}}]}]}],"properties":{"tags":["Cryptography.BannedHashAlgorithm"],"DevSkimSeverity":"Critical","DevSkimConfidence":"High"}}],"columnKind":"utf16CodeUnits"}]}

::endgroup::
::group::[33m✅ Linted [SPELL] files with [cspell]: Found 14 non blocking error(s) - (4.0s)[0m (expand for details)
- Using [cspell v8.14.1] https://megalinter.io/8.0.0/descriptors/spell_cspell
- MegaLinter key: [SPELL_CSPELL]
- Rules config: [/github/workspace/.cspell.json]
- Number of files analyzed: [32]
--Error detail:
 1/30 .github/auto-label.yaml 897.04ms
 2/30 .github/blunderbuss.yml 145.86ms X
.github/blunderbuss.yml:4:5       - Unknown word (liblaf)     -- - liblaf
	 Suggestions: [lila, libau, libia, libra, libya]
.github/blunderbuss.yml:7:5       - Unknown word (liblaf)     -- - liblaf
	 Suggestions: [lila, libau, libia, libra, libya]
 3/30 .github/megalinter/.checkov.yml 8.51ms
 4/30 .github/megalinter/.devskim.json 158.07ms
 5/30 .github/renovate.json 3.45ms
 6/30 .github/sync-repo-settings.yaml 1.59ms
 7/30 .github/workflows/ci.yaml 6.22ms
 8/30 .github/workflows/megalinter.yaml 97.58ms X
.github/workflows/megalinter.yaml:179:15    - Unknown word (stefanzweifel) -- uses: stefanzweifel/git-auto-commit-action
	 Suggestions: []
 9/30 .gitignore 17.13ms
10/30 .mega-linter.yaml 427.07ms X
.mega-linter.yaml:34:12     - Unknown word (ISORT)      -- - PYTHON_ISORT
	 Suggestions: [SORT, iost, IOST, IGOR, ISAR]
.mega-linter.yaml:35:12     - Unknown word (MYPY)       -- - PYTHON_MYPY
	 Suggestions: [MOPY, MYOPY, MACY, MANY, MAPS]
.mega-linter.yaml:36:12     - Unknown word (PYLINT)     -- - PYTHON_PYLINT
	 Suggestions: [PLYING, PINT, PAINT, PLANT, PLINK]
.mega-linter.yaml:42:12     - Unknown word (DEVSKIM)    -- REPOSITORY_DEVSKIM_CONFIG_FILE: .github
	 Suggestions: [DESK, DEVI, DKIM, DEISM, DENIM]
.mega-linter.yaml:42:53     - Unknown word (devskim)    -- .github/megalinter/.devskim.json
	 Suggestions: [desk, devi, dkim, deism, denim]
.mega-linter.yaml:43:12     - Unknown word (KICS)       -- REPOSITORY_KICS_CONFIG_FILE: .github
	 Suggestions: [KI'S, KICK, KIDS, KINS, KIPS]
.mega-linter.yaml:43:49     - Unknown word (kics)       -- .github/megalinter/kics.config
	 Suggestions: [ki's, kick, kids, kins, kips]
11/30 .pre-commit-config.yaml 104.19ms X
.pre-commit-config.yaml:10:13     - Unknown word (commitizen) -- - id: commitizen
	 Suggestions: [comities, commitid, committed, committee, committer]
.pre-commit-config.yaml:38:20     - Unknown word (bidi)       -- - id: forbid-bidi-controls
	 Suggestions: [bide, bids, bini, Bini, bid]
12/30 .vscode/settings.json 1.83ms
13/30 babel.config.js 120.25ms
14/30 docs/avatar/_category_.json 2.96ms
15/30 docs/avatar/jpg.mdx 106.19ms
16/30 docs/avatar/png.mdx 2.88ms
17/30 docs/letter/_category_.json 2.22ms
18/30 docs/letter/ico.mdx 2.23ms
19/30 docs/letter/png.mdx 1.82ms
20/30 docs/letter/svg.mdx 2.36ms
21/30 docs/README.mdx 1.80ms
22/30 docusaurus.config.ts 14.04ms
23/30 e78fd5cc-71e0-4687-ad38-e559a516966a-megalinter_file_names_cspell.txt 116.73ms X
e78fd5cc-71e0-4687-ad38-e559a516966a-megalinter_file_names_cspell.txt:5:20      - Unknown word (devskim)    -- github megalinter devskim
	 Suggestions: [desk, devi, dkim, deism, denim]
e78fd5cc-71e0-4687-ad38-e559a516966a-megalinter_file_names_cspell.txt:30:8      - Unknown word (nojekyll)   -- static nojekyll
	 Suggestions: [novell]
24/30 Makefile 10.29ms
25/30 package.json 4.85ms
26/30 README.md 7.71ms
27/30 src/components/Avatars/styles.module.css 10.72ms
28/30 src/components/Letters/styles.module.css 1.40ms
29/30 static/.nojekyll 1.39ms
30/30 tsconfig.json 1.90ms
CSpell: Files checked: 30, Issues found: 14 in 5 files.

::endgroup::
::group::[32m✅ Linted [YAML] files with [v8r] successfully - (5.31s)[0m (expand for details)
- Using [v8r v4.0.1] https://megalinter.io/8.0.0/descriptors/yaml_v8r
- MegaLinter key: [YAML_V8R]
- Rules config: identified by [v8r]
- Number of files analyzed: [9]
::endgroup::
::group::[32m✅ Linted [REPOSITORY] files with [kics] successfully - (1.83s)[0m (expand for details)
- Using [kics v2.1.2] https://megalinter.io/8.0.0/descriptors/repository_kics
- MegaLinter key: [REPOSITORY_KICS]
- Rules config: [/github/workspace/.github/megalinter/kics.config]
::endgroup::
::group::[31m❌ Linted [REPOSITORY] files with [trivy]: Found 1 error(s) - (6.11s)[0m (expand for details)
- Using [trivy v0.54.1] https://megalinter.io/8.0.0/descriptors/repository_trivy
- MegaLinter key: [REPOSITORY_TRIVY]
- Rules config: identified by [trivy]
--Error detail:
2024-10-12T11:55:43Z	INFO	[db] Need to update DB
2024-10-12T11:55:43Z	INFO	[db] Downloading DB...	repository="ghcr.io/aquasecurity/trivy-db:2"
39.04 MiB / 54.20 MiB [------------------------------------------->_________________] 72.02% ? p/s ?54.20 MiB / 54.20 MiB [----------------------------------------------------------->] 100.00% ? p/s ?54.20 MiB / 54.20 MiB [----------------------------------------------------------->] 100.00% ? p/s ?54.20 MiB / 54.20 MiB [---------------------------------------------->] 100.00% 25.44 MiB p/s ETA 0s54.20 MiB / 54.20 MiB [---------------------------------------------->] 100.00% 25.44 MiB p/s ETA 0s54.20 MiB / 54.20 MiB [---------------------------------------------->] 100.00% 25.44 MiB p/s ETA 0s54.20 MiB / 54.20 MiB [---------------------------------------------->] 100.00% 23.80 MiB p/s ETA 0s54.20 MiB / 54.20 MiB [---------------------------------------------->] 100.00% 23.80 MiB p/s ETA 0s54.20 MiB / 54.20 MiB [---------------------------------------------->] 100.00% 23.80 MiB p/s ETA 0s54.20 MiB / 54.20 MiB [---------------------------------------------->] 100.00% 22.27 MiB p/s ETA 0s54.20 MiB / 54.20 MiB [---------------------------------------------->] 100.00% 22.27 MiB p/s ETA 0s54.20 MiB / 54.20 MiB [---------------------------------------------->] 100.00% 22.27 MiB p/s ETA 0s54.20 MiB / 54.20 MiB [---------------------------------------------->] 100.00% 20.83 MiB p/s ETA 0s54.20 MiB / 54.20 MiB [---------------------------------------------->] 100.00% 20.83 MiB p/s ETA 0s54.20 MiB / 54.20 MiB [---------------------------------------------->] 100.00% 20.83 MiB p/s ETA 0s54.20 MiB / 54.20 MiB [---------------------------------------------->] 100.00% 19.49 MiB p/s ETA 0s54.20 MiB / 54.20 MiB [-------------------------------------------------] 100.00% 17.55 MiB p/s 3.3s2024-10-12T11:55:47Z	INFO	[vuln] Vulnerability scanning is enabled
2024-10-12T11:55:47Z	INFO	[misconfig] Misconfiguration scanning is enabled
2024-10-12T11:55:47Z	INFO	Need to update the built-in policies
2024-10-12T11:55:47Z	INFO	Downloading the built-in policies...
74.86 KiB / 74.86 KiB [-----------------------------------------------------------] 100.00% ? p/s 0s2024-10-12T11:55:47Z	INFO	[pnpm] To collect the license information of packages, "pnpm install" needs to be performed beforehand	dir="node_modules"
2024-10-12T11:55:48Z	INFO	Number of language-specific files	num=1
2024-10-12T11:55:48Z	INFO	[pnpm] Detecting vulnerabilities...
2024-10-12T11:55:48Z	INFO	Detected config files	num=0

For OSS Maintainers: VEX Notice
--------------------------------
If you're an OSS maintainer and Trivy has detected vulnerabilities in your project that you believe are not actually exploitable, consider issuing a VEX (Vulnerability Exploitability eXchange) statement.
VEX allows you to communicate the actual status of vulnerabilities in your project, improving security transparency and reducing false positives for your users.
Learn more and start using VEX: https://aquasecurity.github.io/trivy/v0.54/docs/supply-chain/vex/repo#publishing-vex-documents

To disable this notice, set the TRIVY_DISABLE_VEX_NOTICE environment variable.


pnpm-lock.yaml (pnpm)
=====================
Total: 8 (UNKNOWN: 0, LOW: 1, MEDIUM: 3, HIGH: 4, CRITICAL: 0)

┌────────────────┬────────────────┬──────────┬────────┬───────────────────┬────────────────────────────────────┬──────────────────────────────────────────────────────────────━
│    Library     │ Vulnerability  │ Severity │ Status │ Installed Version │           Fixed Version            │                            Title                             │
├────────────────┼────────────────┼──────────┼────────┼───────────────────┼────────────────────────────────────┼──────────────────────────────────────────────────────────────┤
│ body-parser    │ CVE-2024-45590 │ HIGH     │ fixed  │ 1.20.2            │ 1.20.3                             │ body-parser: Denial of Service Vulnerability in body-parser  │
│                │                │          │        │                   │                                    │ https://avd.aquasec.com/nvd/cve-2024-45590                   │
├────────────────┼────────────────┼──────────┤        ├───────────────────┼────────────────────────────────────┼──────────────────────────────────────────────────────────────┤
│ cookie         │ CVE-2024-47764 │ LOW      │        │ 0.6.0             │ 0.7.0                              │ cookie: cookie accepts cookie name, path, and domain with    │
│                │                │          │        │                   │                                    │ out of bounds...                                             │
│                │                │          │        │                   │                                    │ https://avd.aquasec.com/nvd/cve-2024-47764                   │
├────────────────┼────────────────┼──────────┤        ├───────────────────┼────────────────────────────────────┼──────────────────────────────────────────────────────────────┤
│ express        │ CVE-2024-43796 │ MEDIUM   │        │ 4.19.2            │ 4.20.0, 5.0.0                      │ express: Improper Input Handling in Express Redirects        │
│                │                │          │        │                   │                                    │ https://avd.aquasec.com/nvd/cve-2024-43796                   │
├────────────────┼────────────────┼──────────┤        ├───────────────────┼────────────────────────────────────┼──────────────────────────────────────────────────────────────┤
│ path-to-regexp │ CVE-2024-45296 │ HIGH     │        │ 0.1.7             │ 1.9.0, 0.1.10, 8.0.0, 3.3.0, 6.3.0 │ path-to-regexp: Backtracking regular expressions cause ReDoS │
│                │                │          │        │                   │                                    │ https://avd.aquasec.com/nvd/cve-2024-45296                   │
│                │                │          │        ├───────────────────┤                                    │                                                              │
│                │                │          │        │ 1.8.0             │                                    │                                                              │
│                │                │          │        │                   │                                    │                                                              │
│                │                │          │        ├───────────────────┤                                    │                                                              │
│                │                │          │        │ 2.2.1             │                                    │                                                              │
│                │                │          │        │                   │                                    │                                                              │
├────────────────┼────────────────┼──────────┤        ├───────────────────┼────────────────────────────────────┼──────────────────────────────────────────────────────────────┤
│ send           │ CVE-2024-43799 │ MEDIUM   │        │ 0.18.0            │ 0.19.0                             │ send: Code Execution Vulnerability in Send Library           │
│                │                │          │        │                   │                                    │ https://avd.aquasec.com/nvd/cve-2024-43799                   │
├────────────────┼────────────────┤          │        ├───────────────────┼────────────────────────────────────┼──────────────────────────────────────────────────────────────┤
│ serve-static   │ CVE-2024-43800 │          │        │ 1.15.0            │ 1.16.0, 2.1.0                      │ serve-static: Improper Sanitization in serve-static          │
│                │                │          │        │                   │                                    │ https://avd.aquasec.com/nvd/cve-2024-43800                   │
└────────────────┴────────────────┴──────────┴────────┴───────────────────┴────────────────────────────────────┴──────────────────────────────────────────────────────────────┘

::endgroup::
::group::[32m✅ Linted [REPOSITORY] files with [trivy-sbom] successfully - (1.05s)[0m (expand for details)
- Using [trivy-sbom v0.54.1] https://megalinter.io/8.0.0/descriptors/repository_trivy_sbom
- MegaLinter key: [REPOSITORY_TRIVY_SBOM]
- Rules config: identified by [trivy-sbom]
::endgroup::
::group::[32m✅ Linted [JSON] files with [v8r] successfully - (19.64s)[0m (expand for details)
- Using [v8r v4.0.1] https://megalinter.io/8.0.0/descriptors/json_v8r
- MegaLinter key: [JSON_V8R]
- Rules config: identified by [v8r]
- Number of files analyzed: [8]
::endgroup::
::group::[31m❌ Linted [REPOSITORY] files with [grype]: Found 8 error(s) - (13.09s)[0m (expand for details)
- Using [grype v0.79.5] https://megalinter.io/8.0.0/descriptors/repository_grype
- MegaLinter key: [REPOSITORY_GRYPE]
- Rules config: [.grype.yaml]
--Error detail:
NAME            INSTALLED  FIXED-IN  TYPE  VULNERABILITY        SEVERITY 
body-parser     1.20.2     1.20.3    npm   GHSA-qwcr-r2fm-qrc7  High      
cookie          0.6.0      0.7.0     npm   GHSA-pxg6-pf52-xh8x  Low       
express         4.19.2     4.20.0    npm   GHSA-qw6h-vgh9-j6wx  Medium    
path-to-regexp  0.1.7      0.1.10    npm   GHSA-9wv6-86v2-598j  High      
path-to-regexp  1.8.0      1.9.0     npm   GHSA-9wv6-86v2-598j  High      
path-to-regexp  2.2.1      3.3.0     npm   GHSA-9wv6-86v2-598j  High      
send            0.18.0     0.19.0    npm   GHSA-m6fv-jmcg-4jfg  Medium    
serve-static    1.15.0     1.16.0    npm   GHSA-cm22-4g7w-348p  Medium
[31mdiscovered vulnerabilities at or above the severity threshold[0m

::endgroup::
::group::[32m✅ Linted [ACTION] files with [actionlint] successfully - (0.03s)[0m (expand for details)
- Using [actionlint v1.7.1] https://megalinter.io/8.0.0/descriptors/action_actionlint
- MegaLinter key: [ACTION_ACTIONLINT]
- Rules config: identified by [actionlint]
- Number of files analyzed: [2]
::endgroup::
::group::[31m❌ Linted [JSON] files with [jsonlint]: Found 1 error(s) - (0.16s)[0m (expand for details)
- Using [jsonlint v16.0.0] https://megalinter.io/8.0.0/descriptors/json_jsonlint
- MegaLinter key: [JSON_JSONLINT]
- Rules config: identified by [jsonlint]
- Number of files analyzed: [8]
--Error detail:
File: tsconfig.json
Parse error on line 2, column 3:
{  // This file is not ...
---^
Unexpected token "/"

::endgroup::
::group::[32m✅ Linted [REPOSITORY] files with [checkov] successfully - (15.05s)[0m (expand for details)
- Using [checkov v3.2.232] https://megalinter.io/8.0.0/descriptors/repository_checkov
- MegaLinter key: [REPOSITORY_CHECKOV]
- Rules config: [/github/workspace/.github/megalinter/.checkov.yml]
::endgroup::
::group::[32m✅ Linted [REPOSITORY] files with [dustilock] successfully - (0.46s)[0m (expand for details)
- Using [dustilock v1.2.0] https://megalinter.io/8.0.0/descriptors/repository_dustilock
- MegaLinter key: [REPOSITORY_DUSTILOCK]
- Rules config: identified by [dustilock]
::endgroup::
::group::[32m✅ Linted [SPELL] files with [lychee] successfully - (1.86s)[0m (expand for details)
- Using [lychee v0.15.1] https://megalinter.io/8.0.0/descriptors/spell_lychee
- MegaLinter key: [SPELL_LYCHEE]
- Rules config: identified by [lychee]
- Number of files analyzed: [24]
::endgroup::
::group::[32m✅ Linted [JSON] files with [npm-package-json-lint] successfully - (0.34s)[0m (expand for details)
- Using [npm-package-json-lint v8.0.0] https://megalinter.io/8.0.0/descriptors/json_npm_package_json_lint
- MegaLinter key: [JSON_NPM_PACKAGE_JSON_LINT]
- Rules config: [.npmpackagejsonlintrc.json]
::endgroup::
::group::[32m✅ Linted [REPOSITORY] files with [gitleaks] successfully - (1.07s)[0m (expand for details)
- Using [gitleaks v8.18.4] https://megalinter.io/8.0.0/descriptors/repository_gitleaks
- MegaLinter key: [REPOSITORY_GITLEAKS]
- Rules config: [.gitleaks.toml]
::endgroup::
::group::[32m✅ Linted [REPOSITORY] files with [git_diff] successfully - (0.06s)[0m (expand for details)
- Using [git_diff v2.45.2] https://megalinter.io/8.0.0/descriptors/repository_git_diff
- MegaLinter key: [REPOSITORY_GIT_DIFF]
- Rules config: identified by [git_diff]
::endgroup::
::group::[32m✅ Linted [REPOSITORY] files with [syft] successfully - (1.1s)[0m (expand for details)
- Using [syft v1.11.0] https://megalinter.io/8.0.0/descriptors/repository_syft
- MegaLinter key: [REPOSITORY_SYFT]
- Rules config: identified by [syft]
::endgroup::
::group::[32m✅ Linted [REPOSITORY] files with [trufflehog] successfully - (2.9s)[0m (expand for details)
- Using [trufflehog v3.81.9] https://megalinter.io/8.0.0/descriptors/repository_trufflehog
- MegaLinter key: [REPOSITORY_TRUFFLEHOG]
- Rules config: identified by [trufflehog]
::endgroup::
::group::[32m✅ Linted [YAML] files with [yamllint] successfully - (2.41s)[0m (expand for details)
- Using [yamllint v1.35.1] https://megalinter.io/8.0.0/descriptors/yaml_yamllint
- MegaLinter key: [YAML_YAMLLINT]
- Rules config: [.yamllint.yml]
- Number of files analyzed: [9]
::endgroup::
[Updated Sources Reporter] copied 3 fixed source files in folder /github/workspace/megalinter-reports/updated_sources.
Download it from artifacts then copy-paste it in your local repo to apply linters updates
[GitHub Comment Reporter] Posted summary as comment on liblaf/assets #PR38

+----SUMMARY----+--------------------------+---------------+-------+-------+--------+--------------+
| Descriptor    | Linter                   | Mode          | Files | Fixed | Errors | Elapsed time |
+---------------+--------------------------+---------------+-------+-------+--------+--------------+
| ✅ ACTION     | actionlint               | list_of_files |     2 |       |      0 |        0.03s |
| ✅ COPYPASTE  | jscpd                    | project       |   n/a |       |      0 |        1.36s |
| ✅ CSS        | stylelint                | list_of_files |     2 |     0 |      0 |        1.27s |
| ✅ JAVASCRIPT | standard                 | list_of_files |     1 |     1 |      0 |        1.86s |
| ❌ JSON       | jsonlint                 | list_of_files |     8 |       |      1 |        0.16s |
| ✅ JSON       | npm-package-json-lint    | project       |   n/a |       |      0 |        0.34s |
| ✅ JSON       | prettier                 | list_of_files |     8 |     0 |      0 |        0.43s |
| ✅ JSON       | v8r                      | list_of_files |     8 |       |      0 |       19.64s |
| ⚠️ MARKDOWN   | markdownlint             | list_of_files |     1 |     1 |      6 |        0.51s |
| ✅ MARKDOWN   | markdown-link-check      | list_of_files |     1 |       |      0 |        0.84s |
| ✅ MARKDOWN   | markdown-table-formatter | list_of_files |     1 |     1 |      0 |        0.28s |
| ✅ REPOSITORY | checkov                  | project       |   n/a |       |      0 |       15.05s |
| ❌ REPOSITORY | devskim                  | project       |   n/a |       |      7 |        1.45s |
| ✅ REPOSITORY | dustilock                | project       |   n/a |       |      0 |        0.46s |
| ✅ REPOSITORY | gitleaks                 | project       |   n/a |       |      0 |        1.07s |
| ✅ REPOSITORY | git_diff                 | project       |   n/a |       |      0 |        0.06s |
| ❌ REPOSITORY | grype                    | project       |   n/a |       |      8 |       13.09s |
| ✅ REPOSITORY | kics                     | project       |   n/a |       |      0 |        1.83s |
| ✅ REPOSITORY | secretlint               | project       |   n/a |       |      0 |        0.57s |
| ✅ REPOSITORY | syft                     | project       |   n/a |       |      0 |         1.1s |
| ❌ REPOSITORY | trivy                    | project       |   n/a |       |      1 |        6.11s |
| ✅ REPOSITORY | trivy-sbom               | project       |   n/a |       |      0 |        1.05s |
| ✅ REPOSITORY | trufflehog               | project       |   n/a |       |      0 |         2.9s |
| ⚠️ SPELL      | cspell                   | list_of_files |    32 |       |     14 |         4.0s |
| ✅ SPELL      | lychee                   | list_of_files |    24 |       |      0 |        1.86s |
| ❌ TYPESCRIPT | ts-standard              | list_of_files |     1 |     0 |      1 |        4.51s |
| ✅ YAML       | prettier                 | list_of_files |     9 |     1 |      0 |        3.78s |
| ✅ YAML       | v8r                      | list_of_files |     9 |       |      0 |        5.31s |
| ✅ YAML       | yamllint                 | list_of_files |     9 |       |      0 |        2.41s |
+---------------+--------------------------+---------------+-------+-------+--------+--------------+

[34mYou could have same capabilities but better runtime performances if you use a MegaLinter flavor:[0m
- [cupcake] oxsecurity/megalinter/flavors/cupcake@v8 (83 linters) https://megalinter.io/8.0.0/flavors/cupcake/

[MARKDOWN_SUMMARY Reporter] Generated MARKDOWN_SUMMARY report: /github/workspace/megalinter-reports/megalinter-report.md
[31m❌ Error(s) have been found during linting[0m
To disable linters or customize their checks, you can use a .mega-linter.yml file at the root of your repository
More info at https://megalinter.io/8.0.0/configuration/
